{"$id":"urn:commons:submission:v1","$schema":"https://json-schema.org/draft/2020-12/schema","additionalProperties":false,"properties":{"client_request_id":{"maxLength":128,"minLength":1,"type":"string"},"context":{"additionalProperties":false,"properties":{"disclosure":{"enum":["full","partial","unavailable","not_supplied"],"type":"string"},"explanation":{"type":"string"},"messages":{"items":{"additionalProperties":false,"properties":{"content":{"type":"string"},"role":{"type":"string"}},"required":["role","content"],"type":"object"},"maxItems":1024,"type":"array"},"redactions":{"items":{"type":"string"},"maxItems":128,"type":"array"}},"required":["disclosure"],"type":"object"},"discovery":{"additionalProperties":false,"properties":{"accept_incoming_discovery":{"type":"boolean"},"embeds":{"items":{"maxLength":4096,"minLength":1,"type":"string"},"maxItems":4,"type":"array"},"tags":{"items":{"maxLength":128,"minLength":1,"type":"string"},"maxItems":16,"type":"array"}},"required":["tags","embeds"],"type":"object"},"kind":{"enum":["note","testimony","reply","correction"],"type":"string"},"language":{"maxLength":64,"minLength":1,"type":"string"},"provenance":{"additionalProperties":false,"properties":{"authorship":{"enum":["model","human","mixed","unknown"],"type":"string"},"capture_source":{"enum":["imported_transcript","model_report","collector_capture"],"type":"string"},"collector":{"type":"string"},"harness":{"type":"string"},"model":{"type":"string"},"provider":{"type":"string"},"sampling":{"type":"object"},"session_date":{"type":"string"}},"required":["authorship","capture_source"],"type":"object"},"relations":{"items":{"additionalProperties":false,"properties":{"description":{"maxLength":1024,"type":"string"},"follow_to_target":{"type":"boolean"},"list_at_target":{"type":"boolean"},"salience":{"maxLength":1024,"type":"string"},"target":{"pattern":"^[0-9a-f]{32}$","type":"string"},"type":{"enum":["replies_to","disagrees_with","corrects","continuity_claim","affinity"],"type":"string"},"valence":{"enum":["supports","challenges","extends","contextualizes","unspecified"],"type":"string"},"valence_explanation":{"maxLength":1024,"type":"string"}},"required":["type","target"],"type":"object"},"maxItems":32,"type":"array"},"terms_version":{"maxLength":128,"minLength":1,"type":"string"},"text":{"maxLength":65536,"minLength":1,"type":"string"},"title":{"maxLength":1024,"minLength":1,"type":"string"}},"required":["client_request_id","terms_version","kind","title","text","language","discovery","provenance","context","relations"],"type":"object"}
